{
  "program_id": "program:fresh-44d129f9016a0595",
  "schema_version": "ai-experiments.semantic-ir.compact-inspection/v1",
  "scope_fields": [
    "symbol_id",
    "name",
    "type"
  ],
  "state_token": "cap:v1:state:21a9031d3330cc6078562a46630c32f6",
  "targets": [
    {
      "handle": "n0",
      "node_id": "node:fresh-44d129f9016a0595-body",
      "op": "let",
      "parent": null,
      "scope": [
        [
          "param:fresh-44d129f9016a0595-raw-id",
          "rawId",
          "string"
        ]
      ],
      "slot": "body",
      "subtree": {
        "binding": {
          "name": "normalizedId",
          "symbol_id": "local:fresh-44d129f9016a0595-normalized-id",
          "type": "string"
        },
        "node_id": "node:fresh-44d129f9016a0595-body",
        "op": "let",
        "then": {
          "condition": {
            "arguments": [
              {
                "node_id": "node:fresh-44d129f9016a0595-normalized-for-empty",
                "op": "var",
                "symbol_id": "local:fresh-44d129f9016a0595-normalized-id"
              }
            ],
            "node_id": "node:fresh-44d129f9016a0595-is-empty",
            "op": "call",
            "symbol": "string.is_empty"
          },
          "else": {
            "node_id": "node:fresh-44d129f9016a0595-user-match",
            "none": {
              "error": {
                "node_id": "node:fresh-44d129f9016a0595-missing-code",
                "op": "string",
                "value": "not_found_44d129f9016a0595"
              },
              "node_id": "node:fresh-44d129f9016a0595-missing",
              "op": "err"
            },
            "op": "option_match",
            "some": {
              "node_id": "node:fresh-44d129f9016a0595-found",
              "op": "ok",
              "value": {
                "node_id": "node:fresh-44d129f9016a0595-user-ref",
                "op": "var",
                "symbol_id": "local:fresh-44d129f9016a0595-user"
              }
            },
            "some_binding": {
              "name": "user",
              "symbol_id": "local:fresh-44d129f9016a0595-user",
              "type": "user"
            },
            "value": {
              "arguments": [
                {
                  "node_id": "node:fresh-44d129f9016a0595-normalized-for-user",
                  "op": "var",
                  "symbol_id": "local:fresh-44d129f9016a0595-normalized-id"
                }
              ],
              "node_id": "node:fresh-44d129f9016a0595-get-user",
              "op": "call",
              "symbol": "users.get_by_id"
            }
          },
          "node_id": "node:fresh-44d129f9016a0595-validation",
          "op": "if",
          "then": {
            "error": {
              "node_id": "node:fresh-44d129f9016a0595-invalid-code",
              "op": "string",
              "value": "invalid_input_44d129f9016a0595"
            },
            "node_id": "node:fresh-44d129f9016a0595-invalid",
            "op": "err"
          }
        },
        "value": {
          "arguments": [
            {
              "node_id": "node:fresh-44d129f9016a0595-raw-for-normalizer",
              "op": "var",
              "symbol_id": "param:fresh-44d129f9016a0595-raw-id"
            }
          ],
          "node_id": "node:fresh-44d129f9016a0595-normalizer",
          "op": "call",
          "symbol": "string.trim_ascii"
        }
      },
      "target_token": "cap:v1:target:351d28c52f7b8957fd8072e5e5f1a68c"
    }
  ]
}
