{
  "program_id": "program:fresh-429b0e02e09b62c2",
  "schema_version": "ai-experiments.semantic-ir.compact-inspection/v1",
  "scope_fields": [
    "symbol_id",
    "name",
    "type"
  ],
  "state_token": "cap:v1:state:ce4f100b62518284bdc3dd8174ae36b0",
  "targets": [
    {
      "handle": "n0",
      "node_id": "node:fresh-429b0e02e09b62c2-body",
      "op": "let",
      "parent": null,
      "scope": [
        [
          "param:fresh-429b0e02e09b62c2-raw-id",
          "rawId",
          "string"
        ]
      ],
      "slot": "body",
      "subtree": {
        "binding": {
          "name": "normalizedId",
          "symbol_id": "local:fresh-429b0e02e09b62c2-normalized-id",
          "type": "string"
        },
        "node_id": "node:fresh-429b0e02e09b62c2-body",
        "op": "let",
        "then": {
          "condition": {
            "arguments": [
              {
                "node_id": "node:fresh-429b0e02e09b62c2-normalized-for-empty",
                "op": "var",
                "symbol_id": "local:fresh-429b0e02e09b62c2-normalized-id"
              }
            ],
            "node_id": "node:fresh-429b0e02e09b62c2-is-empty",
            "op": "call",
            "symbol": "string.is_empty"
          },
          "else": {
            "node_id": "node:fresh-429b0e02e09b62c2-user-match",
            "none": {
              "error": {
                "node_id": "node:fresh-429b0e02e09b62c2-missing-code",
                "op": "string",
                "value": "not_found_429b0e02e09b62c2"
              },
              "node_id": "node:fresh-429b0e02e09b62c2-missing",
              "op": "err"
            },
            "op": "option_match",
            "some": {
              "node_id": "node:fresh-429b0e02e09b62c2-found",
              "op": "ok",
              "value": {
                "node_id": "node:fresh-429b0e02e09b62c2-user-ref",
                "op": "var",
                "symbol_id": "local:fresh-429b0e02e09b62c2-user"
              }
            },
            "some_binding": {
              "name": "user",
              "symbol_id": "local:fresh-429b0e02e09b62c2-user",
              "type": "user"
            },
            "value": {
              "arguments": [
                {
                  "node_id": "node:fresh-429b0e02e09b62c2-normalized-for-user",
                  "op": "var",
                  "symbol_id": "local:fresh-429b0e02e09b62c2-normalized-id"
                }
              ],
              "node_id": "node:fresh-429b0e02e09b62c2-get-user",
              "op": "call",
              "symbol": "users.get_by_id"
            }
          },
          "node_id": "node:fresh-429b0e02e09b62c2-validation",
          "op": "if",
          "then": {
            "error": {
              "node_id": "node:fresh-429b0e02e09b62c2-invalid-code",
              "op": "string",
              "value": "invalid_input_429b0e02e09b62c2"
            },
            "node_id": "node:fresh-429b0e02e09b62c2-invalid",
            "op": "err"
          }
        },
        "value": {
          "arguments": [
            {
              "node_id": "node:fresh-429b0e02e09b62c2-raw-for-normalizer",
              "op": "var",
              "symbol_id": "param:fresh-429b0e02e09b62c2-raw-id"
            }
          ],
          "node_id": "node:fresh-429b0e02e09b62c2-normalizer",
          "op": "call",
          "symbol": "string.trim_ascii"
        }
      },
      "target_token": "cap:v1:target:c1a8803dd215e15b87d2a2e4055ff2af"
    },
    {
      "handle": "n8",
      "node_id": "node:fresh-429b0e02e09b62c2-user-match",
      "op": "option_match",
      "parent": "n3",
      "scope": [
        [
          "param:fresh-429b0e02e09b62c2-raw-id",
          "rawId",
          "string"
        ],
        [
          "local:fresh-429b0e02e09b62c2-normalized-id",
          "normalizedId",
          "string"
        ]
      ],
      "slot": "else",
      "subtree": {
        "node_id": "node:fresh-429b0e02e09b62c2-user-match",
        "none": {
          "error": {
            "node_id": "node:fresh-429b0e02e09b62c2-missing-code",
            "op": "string",
            "value": "not_found_429b0e02e09b62c2"
          },
          "node_id": "node:fresh-429b0e02e09b62c2-missing",
          "op": "err"
        },
        "op": "option_match",
        "some": {
          "node_id": "node:fresh-429b0e02e09b62c2-found",
          "op": "ok",
          "value": {
            "node_id": "node:fresh-429b0e02e09b62c2-user-ref",
            "op": "var",
            "symbol_id": "local:fresh-429b0e02e09b62c2-user"
          }
        },
        "some_binding": {
          "name": "user",
          "symbol_id": "local:fresh-429b0e02e09b62c2-user",
          "type": "user"
        },
        "value": {
          "arguments": [
            {
              "node_id": "node:fresh-429b0e02e09b62c2-normalized-for-user",
              "op": "var",
              "symbol_id": "local:fresh-429b0e02e09b62c2-normalized-id"
            }
          ],
          "node_id": "node:fresh-429b0e02e09b62c2-get-user",
          "op": "call",
          "symbol": "users.get_by_id"
        }
      },
      "target_token": "cap:v1:target:37b81eb3217e76cc6ed5f020e5954e99"
    }
  ]
}
