{
  "program_id": "program:fresh-af2ae0a860a33b5c",
  "schema_version": "ai-experiments.semantic-ir.compact-inspection/v1",
  "scope_fields": [
    "symbol_id",
    "name",
    "type"
  ],
  "state_token": "cap:v1:state:33106803a688259359a7cb72e5f04506",
  "targets": [
    {
      "handle": "n0",
      "node_id": "node:fresh-af2ae0a860a33b5c-body",
      "op": "let",
      "parent": null,
      "scope": [
        [
          "param:fresh-af2ae0a860a33b5c-raw-id",
          "rawId",
          "string"
        ]
      ],
      "slot": "body",
      "subtree": {
        "binding": {
          "name": "normalizedId",
          "symbol_id": "local:fresh-af2ae0a860a33b5c-normalized-id",
          "type": "string"
        },
        "node_id": "node:fresh-af2ae0a860a33b5c-body",
        "op": "let",
        "then": {
          "condition": {
            "arguments": [
              {
                "node_id": "node:fresh-af2ae0a860a33b5c-normalized-for-empty",
                "op": "var",
                "symbol_id": "local:fresh-af2ae0a860a33b5c-normalized-id"
              }
            ],
            "node_id": "node:fresh-af2ae0a860a33b5c-is-empty",
            "op": "call",
            "symbol": "string.is_empty"
          },
          "else": {
            "node_id": "node:fresh-af2ae0a860a33b5c-user-match",
            "none": {
              "error": {
                "node_id": "node:fresh-af2ae0a860a33b5c-missing-code",
                "op": "string",
                "value": "not_found_af2ae0a860a33b5c"
              },
              "node_id": "node:fresh-af2ae0a860a33b5c-missing",
              "op": "err"
            },
            "op": "option_match",
            "some": {
              "node_id": "node:fresh-af2ae0a860a33b5c-found",
              "op": "ok",
              "value": {
                "node_id": "node:fresh-af2ae0a860a33b5c-user-ref",
                "op": "var",
                "symbol_id": "local:fresh-af2ae0a860a33b5c-user"
              }
            },
            "some_binding": {
              "name": "user",
              "symbol_id": "local:fresh-af2ae0a860a33b5c-user",
              "type": "user"
            },
            "value": {
              "arguments": [
                {
                  "node_id": "node:fresh-af2ae0a860a33b5c-normalized-for-user",
                  "op": "var",
                  "symbol_id": "local:fresh-af2ae0a860a33b5c-normalized-id"
                }
              ],
              "node_id": "node:fresh-af2ae0a860a33b5c-get-user",
              "op": "call",
              "symbol": "users.get_by_id"
            }
          },
          "node_id": "node:fresh-af2ae0a860a33b5c-validation",
          "op": "if",
          "then": {
            "error": {
              "node_id": "node:fresh-af2ae0a860a33b5c-invalid-code",
              "op": "string",
              "value": "invalid_input_af2ae0a860a33b5c"
            },
            "node_id": "node:fresh-af2ae0a860a33b5c-invalid",
            "op": "err"
          }
        },
        "value": {
          "node_id": "node:fresh-af2ae0a860a33b5c-normalizer",
          "op": "var",
          "symbol_id": "param:fresh-af2ae0a860a33b5c-raw-id"
        }
      },
      "target_token": "cap:v1:target:c6fc709953d9fe27f069617cb7b05338"
    },
    {
      "handle": "n1",
      "node_id": "node:fresh-af2ae0a860a33b5c-normalizer",
      "op": "var",
      "parent": "n0",
      "scope": [
        [
          "param:fresh-af2ae0a860a33b5c-raw-id",
          "rawId",
          "string"
        ]
      ],
      "slot": "value",
      "subtree": {
        "node_id": "node:fresh-af2ae0a860a33b5c-normalizer",
        "op": "var",
        "symbol_id": "param:fresh-af2ae0a860a33b5c-raw-id"
      },
      "target_token": "cap:v1:target:6b827a59812501db036ebe17852f752a"
    }
  ]
}
