{
  "program_id": "program:fresh-59e2a9c738eacf39",
  "schema_version": "ai-experiments.semantic-ir.compact-inspection/v1",
  "scope_fields": [
    "symbol_id",
    "name",
    "type"
  ],
  "state_token": "cap:v1:state:aa0ca79510135833ed0595a3fd69e1bc",
  "targets": [
    {
      "handle": "n0",
      "node_id": "node:fresh-59e2a9c738eacf39-body",
      "op": "let",
      "parent": null,
      "scope": [
        [
          "param:fresh-59e2a9c738eacf39-raw-id",
          "rawId",
          "string"
        ]
      ],
      "slot": "body",
      "subtree": {
        "binding": {
          "name": "normalizedId",
          "symbol_id": "local:fresh-59e2a9c738eacf39-normalized-id",
          "type": "string"
        },
        "node_id": "node:fresh-59e2a9c738eacf39-body",
        "op": "let",
        "then": {
          "condition": {
            "arguments": [
              {
                "node_id": "node:fresh-59e2a9c738eacf39-normalized-for-empty",
                "op": "var",
                "symbol_id": "local:fresh-59e2a9c738eacf39-normalized-id"
              }
            ],
            "node_id": "node:fresh-59e2a9c738eacf39-is-empty",
            "op": "call",
            "symbol": "string.is_empty"
          },
          "else": {
            "node_id": "node:fresh-59e2a9c738eacf39-user-match",
            "none": {
              "error": {
                "node_id": "node:fresh-59e2a9c738eacf39-missing-code",
                "op": "string",
                "value": "not_found_59e2a9c738eacf39"
              },
              "node_id": "node:fresh-59e2a9c738eacf39-missing",
              "op": "err"
            },
            "op": "option_match",
            "some": {
              "node_id": "node:fresh-59e2a9c738eacf39-found",
              "op": "ok",
              "value": {
                "node_id": "node:fresh-59e2a9c738eacf39-user-ref",
                "op": "var",
                "symbol_id": "local:fresh-59e2a9c738eacf39-user"
              }
            },
            "some_binding": {
              "name": "user",
              "symbol_id": "local:fresh-59e2a9c738eacf39-user",
              "type": "user"
            },
            "value": {
              "arguments": [
                {
                  "node_id": "node:fresh-59e2a9c738eacf39-normalized-for-user",
                  "op": "var",
                  "symbol_id": "local:fresh-59e2a9c738eacf39-normalized-id"
                }
              ],
              "node_id": "node:fresh-59e2a9c738eacf39-get-user",
              "op": "call",
              "symbol": "users.get_by_id"
            }
          },
          "node_id": "node:fresh-59e2a9c738eacf39-validation",
          "op": "if",
          "then": {
            "error": {
              "node_id": "node:fresh-59e2a9c738eacf39-invalid-code",
              "op": "string",
              "value": "invalid_input_59e2a9c738eacf39"
            },
            "node_id": "node:fresh-59e2a9c738eacf39-invalid",
            "op": "err"
          }
        },
        "value": {
          "arguments": [
            {
              "node_id": "node:fresh-59e2a9c738eacf39-raw-for-normalizer",
              "op": "var",
              "symbol_id": "param:fresh-59e2a9c738eacf39-raw-id"
            }
          ],
          "node_id": "node:fresh-59e2a9c738eacf39-normalizer",
          "op": "call",
          "symbol": "string.trim_ascii"
        }
      },
      "target_token": "cap:v1:target:b761b72a78c89b90ec7bd2452cd949c2"
    },
    {
      "handle": "n8",
      "node_id": "node:fresh-59e2a9c738eacf39-user-match",
      "op": "option_match",
      "parent": "n3",
      "scope": [
        [
          "param:fresh-59e2a9c738eacf39-raw-id",
          "rawId",
          "string"
        ],
        [
          "local:fresh-59e2a9c738eacf39-normalized-id",
          "normalizedId",
          "string"
        ]
      ],
      "slot": "else",
      "subtree": {
        "node_id": "node:fresh-59e2a9c738eacf39-user-match",
        "none": {
          "error": {
            "node_id": "node:fresh-59e2a9c738eacf39-missing-code",
            "op": "string",
            "value": "not_found_59e2a9c738eacf39"
          },
          "node_id": "node:fresh-59e2a9c738eacf39-missing",
          "op": "err"
        },
        "op": "option_match",
        "some": {
          "node_id": "node:fresh-59e2a9c738eacf39-found",
          "op": "ok",
          "value": {
            "node_id": "node:fresh-59e2a9c738eacf39-user-ref",
            "op": "var",
            "symbol_id": "local:fresh-59e2a9c738eacf39-user"
          }
        },
        "some_binding": {
          "name": "user",
          "symbol_id": "local:fresh-59e2a9c738eacf39-user",
          "type": "user"
        },
        "value": {
          "arguments": [
            {
              "node_id": "node:fresh-59e2a9c738eacf39-normalized-for-user",
              "op": "var",
              "symbol_id": "local:fresh-59e2a9c738eacf39-normalized-id"
            }
          ],
          "node_id": "node:fresh-59e2a9c738eacf39-get-user",
          "op": "call",
          "symbol": "users.get_by_id"
        }
      },
      "target_token": "cap:v1:target:0d40a22ef45245a667a646743d2d9c34"
    }
  ]
}
